{
  "$schema": "http://json-schema.org/draft-07/schema#",
  "title": "Policy Signal Daily Brief — day file",
  "type": "object",
  "additionalProperties": false,
  "required": [
    "schema_version",
    "date",
    "published_at",
    "last_verified_at",
    "no_material_developments",
    "items",
    "corrections"
  ],
  "properties": {
    "schema_version": { "const": 1 },
    "date": { "type": "string", "pattern": "^\\d{4}-\\d{2}-\\d{2}$" },
    "published_at": { "type": "string", "pattern": "^\\d{4}-\\d{2}-\\d{2}T\\d{2}:\\d{2}:\\d{2}Z$" },
    "last_verified_at": { "type": "string", "pattern": "^\\d{4}-\\d{2}-\\d{2}T\\d{2}:\\d{2}:\\d{2}Z$" },
    "no_material_developments": { "type": "boolean" },
    "notice": { "type": ["string", "null"] },
    "items": {
      "type": "array",
      "items": {
        "oneOf": [
          { "$ref": "#/definitions/tierA" },
          { "$ref": "#/definitions/tierB" }
        ]
      }
    },
    "corrections": {
      "type": "array",
      "items": {
        "type": "object",
        "additionalProperties": false,
        "required": ["appended_at", "item_ref", "note"],
        "properties": {
          "appended_at": { "type": "string", "pattern": "^\\d{4}-\\d{2}-\\d{2}T\\d{2}:\\d{2}:\\d{2}Z$" },
          "item_ref": { "type": ["integer", "null"] },
          "note": { "type": "string", "minLength": 1 }
        }
      }
    }
  },
  "definitions": {
    "tierA": {
      "type": "object",
      "additionalProperties": false,
      "required": ["tier", "kind", "jurisdiction", "instrument_ref", "source_url", "event_date"],
      "properties": {
        "tier": { "const": "A" },
        "kind": { "enum": ["appeared", "content_changed", "status_action"] },
        "jurisdiction": { "type": "string", "minLength": 2 },
        "instrument_ref": { "type": "string", "minLength": 1 },
        "source_url": { "type": "string", "pattern": "^https://" },
        "event_date": { "type": "string", "pattern": "^\\d{4}-\\d{2}-\\d{2}$" }
      }
    },
    "tierB": {
      "type": "object",
      "additionalProperties": false,
      "required": ["tier", "headline", "body", "citations", "approved_by_role", "approval_id"],
      "properties": {
        "tier": { "const": "B" },
        "headline": { "type": "string", "minLength": 1 },
        "body": { "type": "string", "minLength": 1 },
        "citations": {
          "type": "array",
          "minItems": 1,
          "items": {
            "type": "object",
            "additionalProperties": false,
            "required": ["label", "url"],
            "properties": {
              "label": { "type": "string", "minLength": 1 },
              "url": { "type": "string", "pattern": "^https://" }
            }
          }
        },
        "approved_by_role": { "type": "string", "minLength": 1 },
        "approval_id": { "type": "string", "pattern": "^ap_[A-Za-z0-9_-]+$" }
      }
    }
  }
}
