{
  "schema_version": 1,
  "date": "2026-07-28",
  "published_at": "2026-07-28T13:00:00Z",
  "last_verified_at": "2026-07-28T12:55:00Z",
  "no_material_developments": true,
  "notice": "Preview publication. The Policy Signal monitoring system is in staged rollout; automated daily publishing begins when the federal vertical slice passes its evaluation gates.",
  "items": [],
  "corrections": []
}
